[
  {
    "id": 110,
    "name": "Grand Café Oslo",
    "address": "Karl Johans gt. 31, 0159 Oslo, Norway",
    "coords": [
      59.913869700000006,
      10.7390261
    ],
    "category": "restaurant",
    "area": "Sentrum",
    "rating": 4.2,
    "facing": null,
    "openingHours": {
      "open": 7,
      "close": 21
    },
    "openingHoursWeekly": {
      "0": {
        "open": 7,
        "close": 10.5
      },
      "1": {
        "open": 12,
        "close": 16
      },
      "2": {
        "open": 12,
        "close": 21
      },
      "3": {
        "open": 12,
        "close": 21
      },
      "4": {
        "open": 12,
        "close": 21
      },
      "5": {
        "open": 12,
        "close": 21
      },
      "6": {
        "open": 7,
        "close": 21
      }
    },
    "buildingOsmId": null,
    "googlePlaceId": "ChIJvZf2bn1uQUYRmWuqdBpxS8E",
    "facingSource": null,
    "discoverySignal": "outdoorSeating"
  },
  {
    "id": 111,
    "name": "Williamsburg",
    "address": "Karl Johans gt. 35, 0162 Oslo, Norway",
    "coords": [
      59.91413379999999,
      10.7381028
    ],
    "category": "bar",
    "area": "Sentrum",
    "rating": 3.9,
    "facing": null,
    "openingHours": {
      "open": 11,
      "close": 23
    },
    "buildingOsmId": null,
    "googlePlaceId": "ChIJbZOS8b9vQUYRevPyTUXilPU",
    "facingSource": null,
    "discoverySignal": "outdoorSeating"
  },
  {
    "id": 112,
    "name": "Egon",
    "address": "Karl Johans gt. 37, 0162 Oslo, Norway",
    "coords": [
      59.914251,
      10.7379968
    ],
    "category": "restaurant",
    "area": "Sentrum",
    "rating": 3.9,
    "facing": null,
    "openingHours": {
      "open": 10,
      "close": 23.5
    },
    "openingHoursWeekly": {
      "0": {
        "open": 11,
        "close": 23
      },
      "1": {
        "open": 10,
        "close": 23.5
      },
      "2": {
        "open": 10,
        "close": 23.5
      },
      "3": {
        "open": 10,
        "close": 23.5
      },
      "4": {
        "open": 10,
        "close": 23.5
      },
      "5": {
        "open": 10,
        "close": 23.5
      },
      "6": {
        "open": 10,
        "close": 23.5
      }
    },
    "buildingOsmId": null,
    "googlePlaceId": "ChIJA8iwdX1uQUYRwd38Sxs8rsw",
    "facingSource": null,
    "discoverySignal": "outdoorSeating"
  },
  {
    "id": 113,
    "name": "Andy's Pub",
    "address": "Stortingsgata 8, 0161 Oslo, Norway",
    "coords": [
      59.9132372,
      10.7374235
    ],
    "category": "bar",
    "area": "Sentrum",
    "rating": 3.9,
    "facing": null,
    "openingHours": {
      "open": 13,
      "close": 3.5
    },
    "openingHoursWeekly": {
      "0": {
        "open": 13,
        "close": 3.5
      },
      "1": {
        "open": 15,
        "close": 3.5
      },
      "2": {
        "open": 15,
        "close": 3.5
      },
      "3": {
        "open": 15,
        "close": 3.5
      },
      "4": {
        "open": 15,
        "close": 3.5
      },
      "5": {
        "open": 15,
        "close": 3.5
      },
      "6": {
        "open": 13,
        "close": 3.5
      }
    },
    "buildingOsmId": null,
    "googlePlaceId": "ChIJ6UDFgX1uQUYRR0wX7K4HV3M",
    "facingSource": null,
    "discoverySignal": "outdoorSeating"
  },
  {
    "id": 114,
    "name": "Kolonialen",
    "address": "Sofies gate 16, 0170 Oslo, Norway",
    "coords": [
      59.922903999999996,
      10.7353018
    ],
    "category": "bar",
    "area": "Grünerløkka",
    "rating": 4.4,
    "facing": null,
    "openingHours": {
      "open": 12,
      "close": 24
    },
    "openingHoursWeekly": {
      "1": {
        "open": 17,
        "close": 24
      },
      "2": {
        "open": 17,
        "close": 24
      },
      "3": {
        "open": 17,
        "close": 24
      },
      "4": {
        "open": 17,
        "close": 24
      },
      "5": {
        "open": 17,
        "close": 24
      },
      "6": {
        "open": 12,
        "close": 24
      }
    },
    "buildingOsmId": null,
    "googlePlaceId": "ChIJh202oihvQUYRPfBspCtatRE",
    "facingSource": null,
    "discoverySignal": "both"
  },
  {
    "id": 115,
    "name": "Deiglig",
    "address": "Fyrhuset, Pilestredet 44, 0167 Oslo, Norway",
    "coords": [
      59.9223513,
      10.733484299999999
    ],
    "category": "cafe",
    "area": "Grünerløkka",
    "rating": 4.4,
    "facing": null,
    "openingHours": {
      "open": 10,
      "close": 16
    },
    "openingHoursWeekly": {
      "1": {
        "open": 10,
        "close": 16
      },
      "2": {
        "open": 10,
        "close": 16
      },
      "3": {
        "open": 10,
        "close": 16
      },
      "4": {
        "open": 10,
        "close": 16
      },
      "5": {
        "open": 10,
        "close": 16
      }
    },
    "buildingOsmId": null,
    "googlePlaceId": "ChIJizjWpnluQUYRDM-gOH9hi-M",
    "facingSource": null,
    "discoverySignal": "outdoorSeating"
  },
  {
    "id": 116,
    "name": "Südøst Restaurant",
    "address": "Trondheimsveien 5, 0560 Oslo, Norway",
    "coords": [
      59.918137,
      10.76055
    ],
    "category": "restaurant",
    "area": "Grønland",
    "rating": 4.2,
    "facing": null,
    "openingHours": {
      "open": 14,
      "close": 24
    },
    "openingHoursWeekly": {
      "0": {
        "open": 14,
        "close": 22
      },
      "1": {
        "open": 16,
        "close": 21
      },
      "2": {
        "open": 16,
        "close": 21
      },
      "3": {
        "open": 16,
        "close": 23
      },
      "4": {
        "open": 16,
        "close": 23
      },
      "5": {
        "open": 16,
        "close": 24
      },
      "6": {
        "open": 16,
        "close": 24
      }
    },
    "buildingOsmId": null,
    "googlePlaceId": "ChIJ4fIDQmduQUYRO9LjaRetGeY",
    "facingSource": null,
    "discoverySignal": "outdoorSeating"
  },
  {
    "id": 117,
    "name": "Bettola",
    "address": "Trondheimsveien 2, 0560 Oslo, Norway",
    "coords": [
      59.9183664,
      10.7596382
    ],
    "category": "bar",
    "area": "Grønland",
    "rating": 4.4,
    "facing": null,
    "openingHours": {
      "open": 16,
      "close": 24
    },
    "openingHoursWeekly": {
      "0": {
        "open": 16,
        "close": 24
      },
      "1": {
        "open": 16,
        "close": 24
      },
      "2": {
        "open": 16,
        "close": 24
      },
      "3": {
        "open": 16,
        "close": 24
      },
      "4": {
        "open": 16,
        "close": 1
      },
      "5": {
        "open": 16,
        "close": 2
      },
      "6": {
        "open": 16,
        "close": 2
      }
    },
    "buildingOsmId": null,
    "googlePlaceId": "ChIJjR3ZamduQUYRuzVd_4CzUOo",
    "facingSource": null,
    "discoverySignal": "outdoorSeating"
  },
  {
    "id": 118,
    "name": "Zarathustra Meyhane",
    "address": "Thorvald Meyers gate 80, 0550 Oslo, Norway",
    "coords": [
      59.9185691,
      10.7596986
    ],
    "category": "restaurant",
    "area": "Grønland",
    "rating": 4.3,
    "facing": null,
    "openingHours": {
      "open": 16,
      "close": 22
    },
    "openingHoursWeekly": {
      "2": {
        "open": 16,
        "close": 22
      },
      "3": {
        "open": 16,
        "close": 22
      },
      "4": {
        "open": 16,
        "close": 22
      },
      "5": {
        "open": 16,
        "close": 22
      },
      "6": {
        "open": 16,
        "close": 22
      }
    },
    "buildingOsmId": null,
    "googlePlaceId": "ChIJy327uGpvQUYR9E1EMPSAi5Q",
    "facingSource": null,
    "discoverySignal": "outdoorSeating"
  },
  {
    "id": 119,
    "name": "Nedre Løkka Cocktailbar & Selskapslokaler",
    "address": "Thorvald Meyers gate 89, 0550 Oslo, Norway",
    "coords": [
      59.918749600000005,
      10.7592282
    ],
    "category": "bar",
    "area": "Grønland",
    "rating": 4.2,
    "facing": null,
    "openingHours": {
      "open": 16,
      "close": 3
    },
    "openingHoursWeekly": {
      "1": {
        "open": 16,
        "close": 1
      },
      "2": {
        "open": 16,
        "close": 1
      },
      "3": {
        "open": 16,
        "close": 1
      },
      "4": {
        "open": 16,
        "close": 1
      },
      "5": {
        "open": 16,
        "close": 3
      },
      "6": {
        "open": 16,
        "close": 3
      }
    },
    "buildingOsmId": null,
    "googlePlaceId": "ChIJK_v8GGduQUYRraQO5m9mUu4",
    "facingSource": null,
    "discoverySignal": "outdoorSeating"
  },
  {
    "id": 120,
    "name": "Trancher Entrecôte",
    "address": "Thorvald Meyers gate 78, 0550 Oslo, Norway",
    "coords": [
      59.9188889,
      10.759722199999999
    ],
    "category": "restaurant",
    "area": "Grønland",
    "rating": 4.5,
    "facing": null,
    "openingHours": {
      "open": 16,
      "close": 22
    },
    "openingHoursWeekly": {
      "0": {
        "open": 16,
        "close": 22
      },
      "1": {
        "open": 16,
        "close": 22
      },
      "2": {
        "open": 16,
        "close": 22
      },
      "3": {
        "open": 16,
        "close": 22
      },
      "4": {
        "open": 16,
        "close": 22
      },
      "5": {
        "open": 16,
        "close": 22
      },
      "6": {
        "open": 16,
        "close": 22
      }
    },
    "buildingOsmId": null,
    "googlePlaceId": "ChIJ3YK-GWduQUYRzudfq168yqg",
    "facingSource": null,
    "discoverySignal": "outdoorSeating"
  },
  {
    "id": 121,
    "name": "Skjenkestua Studentbar",
    "address": "Chr. Krohgs gate 32, 0186 Oslo, Norway",
    "coords": [
      59.916062600000004,
      10.7601093
    ],
    "category": "bar",
    "area": "Grønland",
    "rating": 4.7,
    "facing": null,
    "openingHours": {
      "open": 17,
      "close": 23
    },
    "openingHoursWeekly": {
      "4": {
        "open": 17,
        "close": 23
      }
    },
    "buildingOsmId": null,